{"schemaVersion":1,"kind":"midao-baseline-capture","transactionId":"c90dfe6ce32f77010354615795df95c085f16f53f8a830ac8553196b5d178e13","payloadDigests":{"baseline.sql":"5116b2cbea72b9909ddbcb19c66e734e3527fb5514a41848852fa2808cf60409","managed-overlays.sql":"99df3413a1607f110c5cc7870c25408cc4a37a9d030fec0d6e4902bf1c1ad7c2","catalog.cutoff.normalized.json":"1aef5db242b60acc39077d62b189dffa90f6cce148dee34ad2d5330052da7351","toc.normalized.json":"e0a3d8568a36091dc284247ec172c65217fdc164e481ca57eb629b5be788e66c","use-list.txt":"dd6ee8e386a498fcc6c65b9c8dc47d195d1699ce9b63424a58344a9d14fb30db","toc-ownership-map.json":"016013cfa15b6e2e72bfad803d5ce723edbf43e040ddfd08135375979c6b4cd4","dependency-closure.json":"361e58bf78608d3a8491869216b020c1b91b1c853a4b0aa742636c5f1031d806","role-map.json":"7d04b722b58a109488fef7ab85d2b9d2d33c8a925b2c612890993eb9a0173d82","ownership-boundary.json":"091faf15d4645abc09eab8de2280ac6d3a08c470b930b62fe1441c6b43c9ea3a","exclusions.json":"2807fc8bcb006a8ed65d5b7dfe0cd53a499342a2eac41195f0efdad44174b2bc","platform-prerequisites.json":"8173f6ab69f724e53558d68122f946525b643e747b4c909c690423de61290a78","security-drift.json":"562fba23cd29e7711bc0d0a498249c50d7fcb42b91ac1b9e8e30b7a9236767e1","catalog-cutoff.sha256":"29272eb5ad11cedd9ec4dda268b7509e2aef42d746e1aeba7bc0a5d867dc47d6"},"capture":{"count":2,"catalogSha256":"1aef5db242b60acc39077d62b189dffa90f6cce148dee34ad2d5330052da7351","tocSha256":"e0a3d8568a36091dc284247ec172c65217fdc164e481ca57eb629b5be788e66c","renderedBaselineSha256":"5116b2cbea72b9909ddbcb19c66e734e3527fb5514a41848852fa2808cf60409","renderedOverlaySha256":"99df3413a1607f110c5cc7870c25408cc4a37a9d030fec0d6e4902bf1c1ad7c2"},"toolchain":{"supabaseCliVersion":"2.87.2","dumpSchemaSourceSha256":"5cd57189f6565ddf651ff149995398a4c9b1971ca34a0093a77c011a41f21d64","postgresMajor":17,"postgresImage":"postgres@sha256:0027bef26712baaee437a4ea48fdf3d2d2e2bc5f0d81615374408ca320f3c7e3"},"assertions":{"catalogEquivalent":true,"securityPolicyStatus":"known_drift","secretScan":"pass","dataScan":"pass"}}
